{
  "schema_version": "decision-quality-adjudication.v1",
  "adjudication_id": "cyclone-gabrielle-t1-decision-quality-adjudication-v1",
  "record_version": 1,
  "supersedes_record_digest": null,
  "created_on_sydney_date": "2026-08-24",
  "source_evidence": {
    "bundle_id": "35397ba1fb3d15d87ad7c071",
    "bundle_digest": "60ebd29e920a489c3c171d1daf27b6fe85efbc884e77d2763b64b7b6a14d3cdb",
    "review_id": "91753061d940f8fa9be70d81",
    "package_digest": "b7e925e02d3118c888246b78cec248d1237c63d303284e35b461f7aa5b5a03a5",
    "scenario_id": "new-zealand-cyclone-gabrielle-roads-2023-v1",
    "cutoff_id": "T1_COROMANDEL_HIGHWAY_CLOSURES_CONFIRMED",
    "cutoff_at": "2023-02-13T10:40:00+13:00",
    "evidence_classification": "HYBRID_HISTORICAL_REPLAY",
    "review_count": 4,
    "raw_review_result": "REVIEWERS_DO_NOT_AGREE",
    "raw_review_status": "REQUIRES_ADJUDICATION",
    "non_tie_preference_count": 4,
    "maximum_preference_count": 2,
    "preference_consensus_pct": 50.0,
    "score_delta": 0.0
  },
  "adjudication": {
    "status": "PENDING_HUMAN_ADJUDICATION",
    "resolution": null,
    "rationale": null,
    "decided_by_named_study_owner": false,
    "decided_on_sydney_date": null
  },
  "governance": {
    "original_reviews_immutable": true,
    "original_review_count": 4,
    "adjudication_is_not_a_fifth_review": true,
    "raw_review_result_remains_authoritative": true,
    "resolution_is_separate_disposition": true,
    "append_new_record_for_resolution": true
  },
  "claim_boundary": {
    "supports": ["GOVERNED_DECISION_QUALITY_ADJUDICATION_RECORD"],
    "does_not_support": [
      "BUSINESS_OUTCOME_EFFECT",
      "REAL_LOGISTICS_PERFORMANCE",
      "A303_REACTIVATION",
      "MODEL_PROMOTION",
      "PRODUCTION_READINESS",
      "OPERATIONAL_AUTHORITY"
    ]
  },
  "authority": {
    "profile": "LOCAL_EVALUATION_GOVERNANCE_ONLY",
    "network_access_allowed": false,
    "aws_write_allowed": false,
    "review_mutation_allowed": false,
    "action_authority": "NONE",
    "policy_activation_allowed": false,
    "model_promotion_allowed": false,
    "production_effect": false,
    "a303_reactivation_allowed": false
  },
  "operational_mutations": [],
  "record_digest": "01912186c48676886d0f7a18775dfe160002fae56f416258fadfe4480ac963bf"
}
